{
  "title": "Благоустройство набережной реки Тобол",
  "slug": "blagoustroystvo-naberezhnoy-reki-tobol",
  "city": "Курган",
  "shortDescription": "Комплексное благоустройство участка набережной в районе Энергетики.",
  "whatWasDone": "Выполнены работы по благоустройству участка набережной протяженностью около 300 метров: асфальтирование, устройство ограждений, лестницы и ограждения лестничного участка. Также установлены лавочки и урны для пешеходной зоны.",
  "image": "/assets/images/placeholders/landscaping.svg",
  "gallery": [
    "/assets/images/placeholders/landscaping.svg"
  ],
  "order": 1,
  "isActive": true,
  "year": 2023,
  "seoTitle": "Благоустройство набережной реки Тобол — СМУ-1",
  "seoDescription": "Кейс СМУ-1: благоустройство участка набережной реки Тобол в Кургане, асфальтирование, ограждения, лестница, лавочки и урны."
}
