{
  "title": "Городские качели для общественных территорий",
  "slug": "gorodskie-kacheli-dlya-obshchestvennyh-territoriy",
  "city": "Курган",
  "shortDescription": "Изготовление и установка двух городских качелей из металла и дерева.",
  "whatWasDone": "СМУ-1 выполнила полный цикл работ по двум качелям для городских территорий: проектирование, изготовление металлического каркаса, сварка, сборка и установка на объекте. В конструкции использованы металл и дерево.",
  "image": "/uploads/project-05e1cb18f1d596a46bdacc90.jpg",
  "gallery": [
    "/uploads/project-c9865e6f9d5ef6d37fbd9895.jpg",
    "/uploads/project-93a94bd9fbec9f730574cfee.jpg",
    "/uploads/project-684ea95d87f32fae2eea2987.jpg",
    "/uploads/project-05c77513c1a391e5a71a7dee.jpg",
    "/uploads/project-24b71828f5efa9730bdde4ae.jpg"
  ],
  "order": 4,
  "isActive": true,
  "year": 2024,
  "seoTitle": "Городские качели для общественных территорий — СМУ-1",
  "seoDescription": "Кейс СМУ-1: проектирование, изготовление, сборка и установка двух городских качелей из металла и дерева в Кургане."
}
