{
  "title": "Объект: входная группа (контент уточняется)",
  "slug": "objekt-vhodnaya-gruppa",
  "city": "Курган",
  "shortDescription": "Служебная заглушка. Отключена после добавления реальных объектов.",
  "whatWasDone": "Служебная заглушка. Не показывать на сайте.",
  "image": "/assets/images/objects/object-3.svg",
  "gallery": [
    "/assets/images/objects/object-3.svg",
    "/assets/images/objects/object-4.svg"
  ],
  "order": 901,
  "isActive": false,
  "year": 2025,
  "seoTitle": "Служебная заглушка — СМУ-1",
  "seoDescription": "Служебная заглушка выполненного объекта."
}
