{
  "title": "Объект: парковая зона (контент уточняется)",
  "slug": "objekt-parkovaya-zona",
  "city": "Курган",
  "shortDescription": "Служебная заглушка. Отключена после добавления реальных объектов.",
  "whatWasDone": "Служебная заглушка. Не показывать на сайте.",
  "image": "/assets/images/objects/object-1.svg",
  "gallery": [
    "/assets/images/objects/object-1.svg",
    "/assets/images/objects/object-2.svg"
  ],
  "order": 900,
  "isActive": false,
  "year": 2025,
  "seoTitle": "Служебная заглушка — СМУ-1",
  "seoDescription": "Служебная заглушка выполненного объекта."
}
